card-title,card-desc,card-img-url,card-category,card-category-desc,parent-category,parent-category-desc
j,J is the tenth letter in the alphabet.,"https://res.cloudinary.com/dhmaaz5iu/image/upload/v1579036672/68_282_hisapb.jpg",Alphabet,The alphabet is a set of letters that are used to write and form words in one or more languages on the principle that the letters represent basic sounds.,Basics,"Basics include topics such as shapes, time, currency, counting, and other cards that can be applied to every day life."
Drinking Glass,A drinking glass is a form of glassware that is found in the kitchen and used for the purpose of consuming beverages from.,"https://res.cloudinary.com/dhmaaz5iu/image/upload/v1579036689/45_167_chzc1v.jpg",Kitchen,Items and activities that take place or are found in and around the kitchen.,Household,Objects and artefacts that can be found inside the home.
7 o'clock,The 7 o'clock position on a clock is used to indicate the hour of the day or night.,"https://res.cloudinary.com/dhmaaz5iu/image/upload/v1579036706/38_135_fv0q0c.jpg",Time,Time is the indefinite progress of existence and events that occur from the past through the present to the future.,Basics,"Basics include topics such as shapes, time, currency, counting, and other cards that can be applied to every day life."
Telescope,"Telescopes were invented in the Netherlands around the 17th century. They're used in observing distant locations, often the stars and moon, by collecting electromagnetic radiation.","https://res.cloudinary.com/dhmaaz5iu/image/upload/v1579036725/57_1529_qpixrj.jpg",Outdoors,"Areas and places that can be found outdoors, such as park or playgrounds.",Places,"The places category contains PECS cards that are specific to what you may find in and around specific locations, such as a Doctor's Office or a School."
Do Not Run at School,Card depicting a child running from a teacher or tutor figure in a classroom or school. Discourages running from someone of authority.,"https://res.cloudinary.com/dhmaaz5iu/image/upload/v1579036747/40_2530_qgv6xy.jpg",Behaviours,"Behaviours are a manner of behaving or conducting oneself in conjunction with one's environment as a response to stimuli, be it internal or external.",Communicating,"Communication is the activity of conveying information. Communication has been derived from the Latin word ""communis"", meaning to share. Communication requires a sender, a message, and an intended recipient, although the receiver need not be present or aware of the sender's intent to communicate at the time of communication; thus communication can occur across vast distances in time and space. Communication requires that the communicating parties share an area of communicative commonality."
O,O is the fifteenth letter in the alphabet. O is also a vowel.,"https://res.cloudinary.com/dhmaaz5iu/image/upload/v1579036768/68_291_xrx394.jpg",Alphabet,The alphabet is a set of letters that are used to write and form words in one or more languages on the principle that the letters represent basic sounds.,Basics,"Basics include topics such as shapes, time, currency, counting, and other cards that can be applied to every day life."
Help with Cooking,Cooking is the craft of preparing ingredients for the purpose of consumption. To Help With Cooking is the act of assisting the main chef or cook in the arrangement and preparation of the food that’s being cooked.,"https://res.cloudinary.com/dhmaaz5iu/image/upload/v1579036790/63_2560_czwisj.jpg",General Help,"Help is a form of assistance, both self-help and the helping of others. This category includes any action or process which can fall into the category of help.",Self-help,"Self-help, or self-improvement, is a self-guided improvement—economically, intellectually, or emotionally—often with a substantial psychological basis."
Monkey Bars,"Monkey bars, commonly referenced as jungle gyms, are structures typically made from PVC piping or steel frames and found on playgrounds. The term monkey bars derives from the often rambunctious and monkey-like behavior exhibited by children who play on them.","https://res.cloudinary.com/dhmaaz5iu/image/upload/v1579036815/65_477_nvwxvg.jpg",Play,Playing is the act of performing an activity for recreation or pleasure. The word Play is often used by children to describe juvenile-level activities.,Activities,Activites involve anything that keep one active or in the state of being active. Activities usually involve some sort of action.
Potato Chips,"Potato chips are slices of potato that have been deep fried in oil or baked until crunchy. Most commonly served as a snack, potato chips can come in a variety of flavors with the most common being plain and salted.","https://res.cloudinary.com/dhmaaz5iu/image/upload/v1579036840/42_315_i6mro4.jpg",Snacks and More,"Food that can be classified in numerous categories, with a main focus on snack foods.",Foods,"Delicious foods, including deserts and snacks."
Red,The color red.,"https://res.cloudinary.com/dhmaaz5iu/image/upload/v1579036867/74_510_bmfakh.jpg",Colors,"Colors are derived from the spectrum of light. This category contains the basic colors, such as red, green, and blue.",Basics,"Basics include topics such as shapes, time, currency, counting, and other cards that can be applied to every day life."
Wood Clamp,"A wood clamp is a tool used for holding a piece of wood securely, typically for the purpose of holding it in place to be cut. Wood clamps are used extensively in woodworking and construction.","https://res.cloudinary.com/dhmaaz5iu/image/upload/v1579036891/9_203_swnzpz.jpg",Hand Tools,Tools powered only by your hands.,Tools,"Various tools, including hand and power tools."
Broccoli,"Broccoli is high in vitamin C, as well as dietary fiber; it also contains multiple nutrients with potent anti-cancer properties, such as diindolylmethane and small amounts of selenium. A single serving provides more than 30 mg of Vitamin C and a half-cup provides 52 mg of Vitamin C.","https://res.cloudinary.com/dhmaaz5iu/image/upload/v1579036956/19_3_zsyfhe.jpg",Vegetables,Vegetables are parts of plants that are consumed by humans or other animals as food.,Foods,"Delicious foods, including deserts and snacks."
Drum and Cymbal,"A two piece drum-kit made up of a standalone drum and a cymbal. When played, cymbals have a sustained sound of indefinite pitch, with the size of the cymbals affecting their pitch and response rate. Drums themselves produce various sounds that are dependent on several factors, including shape, shell, size, and tension. Most drum sounds are formed from low frequency vibrations.","https://res.cloudinary.com/dhmaaz5iu/image/upload/v1579036969/72_425_hcicri.jpg",Music,"Music is a form of art where sound is the common medium. Music consists of tempo, pitch, and rhythm. Music plays an important part of many cultures and can combine both song and instrumentals.",Activities,Activites involve anything that keep one active or in the state of being active. Activities usually involve some sort of action.
Sneakers,"Sneakers are a type of athletic footwear that is made of flexible material and feature a rubber sole. Once considered just sporting apparel, sneakers have become common in casual footwear due to their style and versatility.","https://res.cloudinary.com/dhmaaz5iu/image/upload/v1579036989/51_187_bbculp.jpg",Feet,"Clothing that is worn on the foot, or feet (plural) such as socks and shoes.",Clothing,"Articles of clothing that can be worn on various parts of the body, such as the head or feet."
Fried Chicken,"Fried Chicken is a dish made up of chicken pieces, such as a breast or leg, that are floured and deep fried in oil. The flour adds a crispy breading to the exterior of the chicken and is often flavored with a variety of spices.","https://res.cloudinary.com/dhmaaz5iu/image/upload/v1579037007/69_2554_ceeuyt.jpg",Meats and more,"PECS cards of and related to meat, which is animal flesh consumed as food.",Foods,"Delicious foods, including deserts and snacks."
Hot dog,"A hot dog is a sausage served in a sliced bun. It is very often garnished with mustard, ketchup, onions, mayonnaise, relish and/or sauerkraut.","https://res.cloudinary.com/dhmaaz5iu/image/upload/v1579037054/17_19_shzmsz.jpg",Fast Food,Fast food is a type of mass-produced food designed for commercial resale and with a strong priority placed on speed of service versus other relevant factors involved in culinary science.,Foods,"Delicious foods, including deserts and snacks."
Shirt,"A shirt is a garment worn on the upper body and is typically made from materials such as cotton or silk. Although shirts are typically worn by men, they are also a garment worn by women. Shirts can be sleeved or sleeveless, may or may not have buttons, and may or may not have cuffs.","https://res.cloudinary.com/dhmaaz5iu/image/upload/v1579037077/54_195_ziehhj.jpg",Upper Body,"Clothing worn on the upper body, such as scarfs or shirts.",Clothing,"Articles of clothing that can be worn on various parts of the body, such as the head or feet."
Church,A church is a religious structure for the purpose of worship and practicing ones faith. Traditional churches frequently have domed towers and are adorned with crosses.,"https://res.cloudinary.com/dhmaaz5iu/image/upload/v1579037100/62_243_nb8kur.jpg",Church,"Things found in and around churches of various faith including the bible, candles, and crosses.",Places,"The places category contains PECS cards that are specific to what you may find in and around specific locations, such as a Doctor's Office or a School."
Pool,"A pool, or swimming pool, is a man-made container filled with water that is used for entertainment, sport, or recreation. Pools come in many shapes, sizes, and depths and can be made above ground or in-ground.","https://res.cloudinary.com/dhmaaz5iu/image/upload/v1579037123/57_2526_muvfyz.jpg",Outdoors,"Areas and places that can be found outdoors, such as park or playgrounds.",Places,"The places category contains PECS cards that are specific to what you may find in and around specific locations, such as a Doctor's Office or a School."
Mailbox,"A mailbox, also known as a post box or drop box, is a physical box that is used for the purpose of mail delivery, either outgoing or incoming. The content of a mailbox is box collected and delivered, usually daily, by a member of the postal service.","https://res.cloudinary.com/dhmaaz5iu/image/upload/v1579037146/57_1517_tu5zsq.jpg",Outdoors,"Areas and places that can be found outdoors, such as park or playgrounds.",Places,"The places category contains PECS cards that are specific to what you may find in and around specific locations, such as a Doctor's Office or a School."
Bottled Water,"Water is a chemical compound with the very well known formula of H2O, which is made up of two hydrogen atoms and one oxygen. Water is liquid in nature, but co-exists on Earth in various states, including solid (ice) and gaseous (steam / vapor).","https://res.cloudinary.com/dhmaaz5iu/image/upload/v1579037171/42_461_abmxm6.jpg",Snacks and More,"Food that can be classified in numerous categories, with a main focus on snack foods.",Foods,"Delicious foods, including deserts and snacks."
Minivan,"Minivan is a type of van designed for personal use. Minivans are typically either two-box or one box designs for maximum interior volume – and are taller than a sedan, hatchback, or a station wagon.","https://res.cloudinary.com/dhmaaz5iu/image/upload/v1579037195/24_33_jiyxz4.jpg",Ground,Transportation that takes place on the ground and on roads.,Transportation,"Transport or transportation is the movement of people, cattle, animals and goods from one location to another. Modes of transport include air, rail, road, water, cable, pipeline, and space."
Pen,"Pens are devices used to apply ink on a surface, typically paper. Modern pens come in many varieties and colors, with typical pens being ballpoint or rollerball. Past pens were made from reeds or quill and were dipped into wells of ink.","https://res.cloudinary.com/dhmaaz5iu/image/upload/v1579037225/60_233_oxkm0v.jpg",School,"Things of and related to school, which is an institution designated for teach students in various subjects, such as math, science, and literature.",Places,"The places category contains PECS cards that are specific to what you may find in and around specific locations, such as a Doctor's Office or a School."
3 o'clock,The 3 o'clock position on a clock is used to indicate the hour of the day or night.,"https://res.cloudinary.com/dhmaaz5iu/image/upload/v1579037252/38_131_it5ipq.jpg",Time,Time is the indefinite progress of existence and events that occur from the past through the present to the future.,Basics,"Basics include topics such as shapes, time, currency, counting, and other cards that can be applied to every day life."
Put in backpack,"The act of putting school supplies, such as books or pencils, in a backpack.","https://res.cloudinary.com/dhmaaz5iu/image/upload/v1579037329/60_236_rf1vc9.jpg",School,"Things of and related to school, which is an institution designated for teach students in various subjects, such as math, science, and literature.",Places,"The places category contains PECS cards that are specific to what you may find in and around specific locations, such as a Doctor's Office or a School."
Friends,"Friendship is a form of interpersonal relationship generally considered to be closer than association, although there is a range of degrees of intimacy in both friendships and associations.","https://res.cloudinary.com/dhmaaz5iu/image/upload/v1579037344/28_50_ttlziw.jpg",Groups,One or more people together making up a group.,People,"People is a plurality of persons considered as a whole, as in an ethnic group or nation."
Nail Clippers,"Nail clippers are a hand tool that's used to trim fingernails and toenails. Most nail clippers are constructed with a compound lever, which is a lever that operates on the premise of resistance and applied force.","https://res.cloudinary.com/dhmaaz5iu/image/upload/v1579037359/43_333_uqrf97.jpg",Bathroom,Items and activities that you would take place or be found in and around the bathroom.,Household,Objects and artefacts that can be found inside the home.
Pliers,"Pliers are a hand-held tool that are used for various purposes, though the typical usage is for holding something in place or for bending an object. Pliers are made up of a pair of metal levers joined on a pivot along with handles (grips) that allow force to be applied.","https://res.cloudinary.com/dhmaaz5iu/image/upload/v1579037374/9_199_camf3g.jpg",Hand Tools,Tools powered only by your hands.,Tools,"Various tools, including hand and power tools."
n,"N is the fourteenth letter in the alphabet. It also represents the element Nitrogen, with an Atomic Number of 7, on the periodic table of elements.","https://res.cloudinary.com/dhmaaz5iu/image/upload/v1579037393/68_290_hv3rel.jpg",Alphabet,The alphabet is a set of letters that are used to write and form words in one or more languages on the principle that the letters represent basic sounds.,Basics,"Basics include topics such as shapes, time, currency, counting, and other cards that can be applied to every day life."
Hair Pulling,"Hair pulling, also known as Trichotillomania, is an impulse control disorder in which one pulls on their own hair, resulting in hair loss or noticeable distress.","https://res.cloudinary.com/dhmaaz5iu/image/upload/v1579037411/40_334_czrpav.jpg",Behaviours,"Behaviours are a manner of behaving or conducting oneself in conjunction with one's environment as a response to stimuli, be it internal or external.",Communicating,"Communication is the activity of conveying information. Communication has been derived from the Latin word ""communis"", meaning to share. Communication requires a sender, a message, and an intended recipient, although the receiver need not be present or aware of the sender's intent to communicate at the time of communication; thus communication can occur across vast distances in time and space. Communication requires that the communicating parties share an area of communicative commonality."
Bra,"A bra, or brassiere, is a form fitting woman's undergarment that is designed to support the breasts. Their primary purpose is to provide comfort, but bra's have evolved into a fashion item.","https://res.cloudinary.com/dhmaaz5iu/image/upload/v1579037433/54_194_pk3nlm.jpg",Upper Body,"Clothing worn on the upper body, such as scarfs or shirts.",Clothing,"Articles of clothing that can be worn on various parts of the body, such as the head or feet."
Square,"A square is the geometrical shape that consists of four equal sides and four right angles, also known as a regular quadrilateral.","https://res.cloudinary.com/dhmaaz5iu/image/upload/v1579037456/37_101_zkpmrc.jpg",Shapes,"A shape is a geometrical description of the part of that space occupied by an object. These include a set of two or more points, a line, a curve, a plane, or a plane figure (square or circle), or a solid figure (cube).",Basics,"Basics include topics such as shapes, time, currency, counting, and other cards that can be applied to every day life."
9 o'clock,The 9 o'clock position on a clock is used to indicate the hour of the day or night.,"https://res.cloudinary.com/dhmaaz5iu/image/upload/v1579037477/38_137_hl9jgq.jpg",Time,Time is the indefinite progress of existence and events that occur from the past through the present to the future.,Basics,"Basics include topics such as shapes, time, currency, counting, and other cards that can be applied to every day life."
Vacuuming,"A Vacuum is a sweeper device used to clean up debris, typically from a floor. Vacuuming is the act of cleaning up using a Vacuum.","https://res.cloudinary.com/dhmaaz5iu/image/upload/v1579037504/48_2552_sxmvml.jpg",Everyday,"Activities that take place on almost every day of the week, such as eating, driving, and sleeping.",Activities,Activites involve anything that keep one active or in the state of being active. Activities usually involve some sort of action.
Brush Teeth,"Brushing teeth is the hygienic process of scrubbing one's teeth with a device with bristles, typically a toothbrush. Health benefits include reducing plaque, preventing gingivitis, and helping to prevent bad breath.","https://res.cloudinary.com/dhmaaz5iu/image/upload/v1579037532/35_74_l0ebsd.jpg",Personal Care,To care for oneself and personal hygiene.,Self-help,"Self-help, or self-improvement, is a self-guided improvement—economically, intellectually, or emotionally—often with a substantial psychological basis."
l,L is the twelfth letter of the alpahbet and also represent the value 50 in Roman numerals.,"https://res.cloudinary.com/dhmaaz5iu/image/upload/v1579037565/68_286_segsgd.jpg",Alphabet,The alphabet is a set of letters that are used to write and form words in one or more languages on the principle that the letters represent basic sounds.,Basics,"Basics include topics such as shapes, time, currency, counting, and other cards that can be applied to every day life."
Sad,"Sadness is emotional pain associated with, or characterized by feelings of disadvantage, loss, despair, helplessness, sorrow, and rage. When sad, people often become outspoken, less energetic, and emotional. Crying is an indication of sadness.","https://res.cloudinary.com/dhmaaz5iu/image/upload/v1579037673/31_59_bzzyf9.jpg",Emotions,"Emotion is a complex psychophysiological experience of an individual's state of mind as interacting with biochemical (internal) and environmental (external) influences. In humans, emotion fundamentally involves ""physiological arousal, expressive behaviors, and conscious experience.""",Communicating,"Communication is the activity of conveying information. Communication has been derived from the Latin word ""communis"", meaning to share. Communication requires a sender, a message, and an intended recipient, although the receiver need not be present or aware of the sender's intent to communicate at the time of communication; thus communication can occur across vast distances in time and space. Communication requires that the communicating parties share an area of communicative commonality."
Singing,Singing is the act of producing musical sounds through use of the voice. Singing can take place with our without the accompanying of instruments.,"https://res.cloudinary.com/dhmaaz5iu/image/upload/v1579037710/49_173_tsunfd.jpg",Entertainment,"Entertainment refers to actions, activities, or events that are designed with the purpose of entertaining. This category includes everything from video games to watching movies.",Activities,Activites involve anything that keep one active or in the state of being active. Activities usually involve some sort of action.
Foot,A foot is the limb which bears the weight of our body to allow us to walk or run. The foot is a separate organ at the bottom of the leg below the ankle and is made up of toes.,"https://res.cloudinary.com/dhmaaz5iu/image/upload/v1579037729/66_378_uql65y.jpg",Body Parts,"Of and relating to the body, including bones, body parts, and facial features.",People,"People is a plurality of persons considered as a whole, as in an ethnic group or nation."
Couch,"A couch, also known as a sofa or love seat, is a piece of furniture that is used for sitting. Couches are typically found in living rooms and placed in front of a television.","https://res.cloudinary.com/dhmaaz5iu/image/upload/v1579037743/44_164_rpcffo.jpg",Family Room,Items and activities that take place or are found in and around the family room.,Household,Objects and artefacts that can be found inside the home.
Tank,"A tank is a tracked, armoured fighting vehicle designed for front-line combat which combines operational mobility, tactical offensive, and defensive capabilities. Firepower is normally provided by a large-calibre main gun in a rotating turret and secondary machine guns, while heavy armour and all-terrain mobility provide protection for the tank and its crew, allowing it to perform all primary tasks of the armoured troops on the battlefield.","https://res.cloudinary.com/dhmaaz5iu/image/upload/v1579037762/25_37_bcmq6q.jpg",Military,Military transportation of various types,Transportation,"Transport or transportation is the movement of people, cattle, animals and goods from one location to another. Modes of transport include air, rail, road, water, cable, pipeline, and space."
Men,In English man (pl. men) lower case refers to an adult human male (the term boy is the usual term for a human male child or adolescent).,"https://res.cloudinary.com/dhmaaz5iu/image/upload/v1579037790/28_47_jvm098.jpg",Groups,One or more people together making up a group.,People,"People is a plurality of persons considered as a whole, as in an ethnic group or nation."
Purple,The color purple.,"https://res.cloudinary.com/dhmaaz5iu/image/upload/v1579037807/74_509_jchjov.jpg",Colors,"Colors are derived from the spectrum of light. This category contains the basic colors, such as red, green, and blue.",Basics,"Basics include topics such as shapes, time, currency, counting, and other cards that can be applied to every day life."
No Nail Biting,"Nail biting, also known as Onychophagia, is a compulsive behavior in both children and adults. The behavior can cause broken skin on the cuticle, which makes the fingers more susceptible to microbial and viral infections.","https://res.cloudinary.com/dhmaaz5iu/image/upload/v1579037829/40_331_xrzilf.jpg",Behaviours,"Behaviours are a manner of behaving or conducting oneself in conjunction with one's environment as a response to stimuli, be it internal or external.",Communicating,"Communication is the activity of conveying information. Communication has been derived from the Latin word ""communis"", meaning to share. Communication requires a sender, a message, and an intended recipient, although the receiver need not be present or aware of the sender's intent to communicate at the time of communication; thus communication can occur across vast distances in time and space. Communication requires that the communicating parties share an area of communicative commonality."
Pickle,A pickle is a cucumber that has been pickled (a fermenting process) in brine or vinegar. Kosher pickles are pickles that are made with garlic and dill weed while fermenting in an acidic solution.,"https://res.cloudinary.com/dhmaaz5iu/image/upload/v1579037851/19_341_lwg74g.jpg",Vegetables,Vegetables are parts of plants that are consumed by humans or other animals as food.,Foods,"Delicious foods, including deserts and snacks."
Go Down Stairs,"To go Down Stairs in the act of descending between floors with the intention of moving lower. Stairs themselves can come in a variety of types, including straight, rounded, with or without rails, tiled or carpeted, and a variety of other aesthetic and functional  designs.","https://res.cloudinary.com/dhmaaz5iu/image/upload/v1579037873/47_465_hs4weu.jpg",General Actions,All actions that do not fall into one of our specific categories. This is the catch all that contains most action related activities.,Activities,Activites involve anything that keep one active or in the state of being active. Activities usually involve some sort of action.
Shirt on,"The act of putting on one's shirt when getting dressed. Polo and t-shirts must go on over the head, as opposed to dress shirts which can go on with one arm at a time.","https://res.cloudinary.com/dhmaaz5iu/image/upload/v1579037897/34_212_qjk7h0.jpg",Dressing,The act of putting on ones clothes to dress oneself.,Self-help,"Self-help, or self-improvement, is a self-guided improvement—economically, intellectually, or emotionally—often with a substantial psychological basis."
