card-title,card-desc,card-img-url,card-category,card-category-desc,parent-category,parent-category-desc
Penny,"A penny is a coin that represents 1-cent of currency and is used in English speaking countries, primarily the United States. It's the smallest denomination in the currency system.","https://res.cloudinary.com/dhmaaz5iu/image/upload/v1578591657/55_205_hbpryr.jpg",Currency,Currency is a generally accepted system of exchange that typically consists of coins and paper money.,Basics,"Basics include topics such as shapes, time, currency, counting, and other cards that can be applied to every day life."
Dancer,A Dancer is an entertainer who performances a series of sequences of human movement that is often considered aesthetically pleasing to the viewer.,"https://res.cloudinary.com/dhmaaz5iu/image/upload/v1578591713/29_2556_bsmbba.jpg",Individuals,A single person or entity.,People,"People is a plurality of persons considered as a whole, as in an ethnic group or nation."
Backpack,"A backpack is a sack made of cloth or nylon that is secured around the shoulders with two straps. Backpacks are used to carry heavy loads, such as books and school supplies, for a long period of time.","https://res.cloudinary.com/dhmaaz5iu/image/upload/v1578591771/60_231_hspjdy.jpg",School,"Things of and related to school, which is an institution designated for teach students in various subjects, such as math, science, and literature.",Places,"The places category contains PECS cards that are specific to what you may find in and around specific locations, such as a Doctor's Office or a School."
Shoulder,"The shoulder is made up of bones, muscles, and ligaments. The major bones of the shoulder include the collar bone (clavicle), the shoulder blade (scapula), and the upper arm bone (humerus).","https://res.cloudinary.com/dhmaaz5iu/image/upload/v1578592362/66_380_ihpdpq.jpg",Body Parts,"Of and relating to the body, including bones, body parts, and facial features.",People,"People is a plurality of persons considered as a whole, as in an ethnic group or nation."
Soda Pop,"Soda (also known as pop, tonic, or soft drink) is a carbonated drink that is characterized by its sweet flavoring and typically contains a flavoring agent, such as vanilla or ginger.","https://res.cloudinary.com/dhmaaz5iu/image/upload/v1578592439/42_343_vpfy00.jpg",Snacks and More,"Food that can be classified in numerous categories, with a main focus on snack foods.",Foods,"Delicious foods, including deserts and snacks."
Classroom,A classroom is a designated room designed for learning. Classrooms are found in educational institutes and are typically made up of students and one or more teachers.,"https://res.cloudinary.com/dhmaaz5iu/image/upload/v1578592514/60_372_jzwamo.jpg",School,"Things of and related to school, which is an institution designated for teach students in various subjects, such as math, science, and literature.",Places,"The places category contains PECS cards that are specific to what you may find in and around specific locations, such as a Doctor's Office or a School."
This one,"The word this is used to indicate or draw attention to a person, place, thing, idea, state, time, or thought. It's often used to distinguish between more than one point of reference.","https://res.cloudinary.com/dhmaaz5iu/image/upload/v1578592577/39_406_xrljjo.jpg",General Communication,"Conveying information through various acts. This category groups many sub-categories together, such as greetings, indicators, and complex feedback.",Communicating,"Communication is the activity of conveying information. Communication has been derived from the Latin word ""communis"", meaning to share. Communication requires a sender, a message, and an intended recipient, although the receiver need not be present or aware of the sender's intent to communicate at the time of communication; thus communication can occur across vast distances in time and space. Communication requires that the communicating parties share an area of communicative commonality."
d,D is the fourth letter of the alphabet. It's also the letter used to represent the value 500 in Roman numerals.,"https://res.cloudinary.com/dhmaaz5iu/image/upload/v1578592644/68_270_pje8zz.jpg",Alphabet,The alphabet is a set of letters that are used to write and form words in one or more languages on the principle that the letters represent basic sounds.,Basics,"Basics include topics such as shapes, time, currency, counting, and other cards that can be applied to every day life."
Sports Car,"A sports car (or sportscar or sport car) is a small, usually two seat, two door automobile designed for high speed driving and maneuverability. Sports cars have been either spartan or luxurious, but good handling, minimum weight, and high performance are requisite.","https://res.cloudinary.com/dhmaaz5iu/image/upload/v1578592711/24_43_a5co6c.jpg",Ground,Transportation that takes place on the ground and on roads.,Transportation,"Transport or transportation is the movement of people, cattle, animals and goods from one location to another. Modes of transport include air, rail, road, water, cable, pipeline, and space."
Mango,"A Mango is a tropical fruit that belong to the flowering plant family Anacardiaceae and is native to Southeast Asia. Mangos are the national fruit of Pakistan, India, and the Philippines.","https://res.cloudinary.com/dhmaaz5iu/image/upload/v1578600359/18_2521_zuzffu.jpg",Fruit,Anything that falls into the fruit category.,Foods,"Delicious foods, including deserts and snacks."
Evening,Evening represents the period of time between afternoon and night time. Evening is typically associated with dusk or just as the night begins to fall.,"https://res.cloudinary.com/dhmaaz5iu/image/upload/v1578600459/38_499_ykrp6g.jpg",Time,Time is the indefinite progress of existence and events that occur from the past through the present to the future.,Basics,"Basics include topics such as shapes, time, currency, counting, and other cards that can be applied to every day life."
Brownie,"A brownie is a baked desert item that is mostly made from chocolate and is best described as a cross between a cake and a cookie. Brownies can come in a variety of shapes and sizes, but is typically formed in the shape of a square.","https://res.cloudinary.com/dhmaaz5iu/image/upload/v1578600589/16_410_so2r2z.jpg",Desserts,"Delicious desserts, including cakes and pies.",Foods,"Delicious foods, including deserts and snacks."
Rectangle,"In geometry, a rectangle is any quadrilateral with four right angles. The word Rectangle is derived from the Latin word rectangulus, which is combined from rectus (right) and angulus (angle).","https://res.cloudinary.com/dhmaaz5iu/image/upload/v1578600668/37_100_buouee.jpg",Shapes,"A shape is a geometrical description of the part of that space occupied by an object. These include a set of two or more points, a line, a curve, a plane, or a plane figure (square or circle), or a solid figure (cube).",Basics,"Basics include topics such as shapes, time, currency, counting, and other cards that can be applied to every day life."
P,"P is the sixteenth letter of the alphabet. P also represents the element Phosphorus, with an Atomic Number of 15, on the Periodic Table of Elements.","https://res.cloudinary.com/dhmaaz5iu/image/upload/v1578600746/68_293_anaq7h.jpg",Alphabet,The alphabet is a set of letters that are used to write and form words in one or more languages on the principle that the letters represent basic sounds.,Basics,"Basics include topics such as shapes, time, currency, counting, and other cards that can be applied to every day life."
Peace,"Hand gesture indicating peace, which is a state of harmony characterized by the lack of violent conflict. The Hebrew word meaning peace is shalom.","https://res.cloudinary.com/dhmaaz5iu/image/upload/v1578601229/39_108_pmwnvf.jpg",General Communication,"Conveying information through various acts. This category groups many sub-categories together, such as greetings, indicators, and complex feedback.",Communicating,"Communication is the activity of conveying information. Communication has been derived from the Latin word ""communis"", meaning to share. Communication requires a sender, a message, and an intended recipient, although the receiver need not be present or aware of the sender's intent to communicate at the time of communication; thus communication can occur across vast distances in time and space. Communication requires that the communicating parties share an area of communicative commonality."
Use Toothpaste,"The act of squeezing toothpaste on a toothbrush in preperation of brushing one's teeth. Toothpaste is used to promote oral hygiene while removing plaque and preventing gum disease, also known as gingivitis. A toothbrush is the tool used to clean the teeth and gums.","https://res.cloudinary.com/dhmaaz5iu/image/upload/v1578601344/35_78_ucuqyg.jpg",Personal Care,To care for oneself and personal hygiene.,Self-help,"Self-help, or self-improvement, is a self-guided improvement—economically, intellectually, or emotionally—often with a substantial psychological basis."
Stove,A stove is a heating appliance that is used for the purpose of cooking. Stoves typically consist of two or more burners that work on the application of direct heat. Stoves may or may not include an oven.,"https://res.cloudinary.com/dhmaaz5iu/image/upload/v1578601433/45_436_tidilm.jpg",Kitchen,Items and activities that take place or are found in and around the kitchen.,Household,Objects and artefacts that can be found inside the home.
Fire Truck,"A fire apparatus, fire engine, fire truck, or fire appliance is a vehicle designed to assist in fighting fires by transporting firefighters to the scene and providing them with access to the fire, along with water or other equipment. In some areas, the terms fire engine and fire truck represent different types of firefighting apparatus.","https://res.cloudinary.com/dhmaaz5iu/image/upload/v1578601527/24_32_ujtlad.jpg",Ground,Transportation that takes place on the ground and on roads.,Transportation,"Transport or transportation is the movement of people, cattle, animals and goods from one location to another. Modes of transport include air, rail, road, water, cable, pipeline, and space."
Women,"A woman (/ˈwʊmən/), pl: women (/ˈwɪmɨn/) is a female human. The term woman is usually reserved for an adult, with the term girl being the usual term for a female child or adolescent.","https://res.cloudinary.com/dhmaaz5iu/image/upload/v1578601613/28_48_wbivgv.jpg",Groups,One or more people together making up a group.,People,"People is a plurality of persons considered as a whole, as in an ethnic group or nation."
Booing,"To “boo” is to show disapproval for something, such as an act or performance. In organized sports, fans often boo the opposition to show displeasure or disgust. In extreme cases, fans may hiss, whistle, and extreme cases throw objects.","https://res.cloudinary.com/dhmaaz5iu/image/upload/v1578601730/75_518_eioip6.jpg",Sports,Sports refer to the collective forms of competitive activities through causal or organized participation.,Activities,Activites involve anything that keep one active or in the state of being active. Activities usually involve some sort of action.
M,M is the thirteenth letter in the alphabet and also represents the value one thousand in Roman numerals.,"https://res.cloudinary.com/dhmaaz5iu/image/upload/v1578643319/68_287_ublusg.jpg",Alphabet,The alphabet is a set of letters that are used to write and form words in one or more languages on the principle that the letters represent basic sounds.,Basics,"Basics include topics such as shapes, time, currency, counting, and other cards that can be applied to every day life."
Cinnamon Roll,"A Cinnamon Roll, also referred to as a Cinnamon Bun, is a soft, sweet roll that is commonly served during breakfast. It’s made up of flour, sugar, butter, and of course cinnamon. Most often the rolls are served with icing.","https://res.cloudinary.com/dhmaaz5iu/image/upload/v1578643632/41_2562_bp3bgi.jpg",Breakfast,"Breakfast is typically the first meal eaten during the day, most often before startiing the daily routine or work.",Foods,"Delicious foods, including deserts and snacks."
Toaster,"A toaster is a small kitchen appliance that is designed to toad bread and bagels. Most toasters are designed with a dial to adjust the level of browning that is applied to the bread, along with a handle that is pushed to begin the toasting process. Once the desired browning is meet, the toasters pops up the bread.","https://res.cloudinary.com/dhmaaz5iu/image/upload/v1578643658/45_170_r8fucz.jpg",Kitchen,Items and activities that take place or are found in and around the kitchen.,Household,Objects and artefacts that can be found inside the home.
Goldfish Crackers,Goldfish Crackers are popular cracker snacks by Pepperidge Farms and come in a variety of flavors and colors. The slogan The Snack That Smiles Back! Goldfish! Is based on a small imprint on the cracker to represent an eye and a smile.,"https://res.cloudinary.com/dhmaaz5iu/image/upload/v1578643685/42_2541_o3kkew.jpg",Snacks and More,"Food that can be classified in numerous categories, with a main focus on snack foods.",Foods,"Delicious foods, including deserts and snacks."
Walk,"Walking is the process of locomotion from the legs. Slower than running ,walking is something most able bodied people do on a daily basis to get from one location to another.","https://res.cloudinary.com/dhmaaz5iu/image/upload/v1578643713/48_396_dhnz83.jpg",Everyday,"Activities that take place on almost every day of the week, such as eating, driving, and sleeping.",Activities,Activites involve anything that keep one active or in the state of being active. Activities usually involve some sort of action.
Sugar,"Sugar is a general term that describes a class of sweet flavored substances. Sugar categories include glucose, fructose, and galactose.","https://res.cloudinary.com/dhmaaz5iu/image/upload/v1578643752/42_457_be5bx2.jpg",Snacks and More,"Food that can be classified in numerous categories, with a main focus on snack foods.",Foods,"Delicious foods, including deserts and snacks."
No Punching,A punch is the strike of the fist and is commonly used as an attack in hand to hand combat.,"https://res.cloudinary.com/dhmaaz5iu/image/upload/v1578643781/40_113_vs7zpg.jpg",Behaviours,"Behaviours are a manner of behaving or conducting oneself in conjunction with one's environment as a response to stimuli, be it internal or external.",Communicating,"Communication is the activity of conveying information. Communication has been derived from the Latin word ""communis"", meaning to share. Communication requires a sender, a message, and an intended recipient, although the receiver need not be present or aware of the sender's intent to communicate at the time of communication; thus communication can occur across vast distances in time and space. Communication requires that the communicating parties share an area of communicative commonality."
Ham,"Ham is a cured or fully cooked cut of meat that comes from the thigh or hind of a pig. Ham is traditionally eaten as part of a holiday meal, including Easter and Christmas.","https://res.cloudinary.com/dhmaaz5iu/image/upload/v1578643810/69_320_xmdjq6.jpg",Meats and more,"PECS cards of and related to meat, which is animal flesh consumed as food.",Foods,"Delicious foods, including deserts and snacks."
Put Star on Tree,"A Christmas tree is a tree that people decorate and adorn with colorful ornaments, tinsel, and lights. Christmas trees are typically pine or firs, but also may come in artificial varieties.  Christmas trees are where Santa places presents for boys and girls on Christmas Day.","https://res.cloudinary.com/dhmaaz5iu/image/upload/v1578643841/59_471_aoqjz9.jpg",Holidays,"A holiday is a designated day of special significance that celebrates religion, individuals, military, or government.  Some holidays, such as Christmas, are considered non-working holidays for the general population.",Basics,"Basics include topics such as shapes, time, currency, counting, and other cards that can be applied to every day life."
Chilli pepper,"Chilli pepper (also chile pepper or chilli pepper, from Nahuatl chilli) is the fruit of plants from the genus Capsicum, members of the nightshade family, Solanaceae. The term in British English and in Australia, New Zealand, India, Malaysia and other Asian countries is just chilli without pepper.","https://res.cloudinary.com/dhmaaz5iu/image/upload/v1578643889/19_26_gdhpjx.jpg",Vegetables,Vegetables are parts of plants that are consumed by humans or other animals as food.,Foods,"Delicious foods, including deserts and snacks."
Oval,"An oval is a closed curve on a plane that is almost egg-like in shape. The word Oval is derived from the Latin ""ovum"", which translates to ""egg"".","https://res.cloudinary.com/dhmaaz5iu/image/upload/v1578643931/37_99_brmzgw.jpg",Shapes,"A shape is a geometrical description of the part of that space occupied by an object. These include a set of two or more points, a line, a curve, a plane, or a plane figure (square or circle), or a solid figure (cube).",Basics,"Basics include topics such as shapes, time, currency, counting, and other cards that can be applied to every day life."
March,March is the third month of the year and is characterized by cold climate in the Northern Hemisphere. There are 31 days in the month of March. Saint Patrick's Day is celebrated in March.,"https://res.cloudinary.com/dhmaaz5iu/image/upload/v1578643965/73_484_tjbokj.jpg",Months,A month is a unit of time that relates to the revolution of the moon. Lunar calendars contain 12 months with an average of 30.5 days per month.,Basics,"Basics include topics such as shapes, time, currency, counting, and other cards that can be applied to every day life."
SUV,"A sport utility vehicle (SUV) is a generic marketing term for a vehicle similar to a station wagon, but built on a light-truck chassis. It is usually equipped with four-wheel drive for on- or off-road ability, and with some pretension or ability to be used as an off-road vehicle.","https://res.cloudinary.com/dhmaaz5iu/image/upload/v1578644003/24_44_bjudwg.jpg",Ground,Transportation that takes place on the ground and on roads.,Transportation,"Transport or transportation is the movement of people, cattle, animals and goods from one location to another. Modes of transport include air, rail, road, water, cable, pipeline, and space."
Hands,"A hand is the multi-fingered extremity that allows us to grasp, touch, and create with. Hands allow for both fine and gross motor skills and provide tactile feedback. Hands are found on primates, such as humans, monkeys, and chimps.","https://res.cloudinary.com/dhmaaz5iu/image/upload/v1578644038/66_382_mimpts.jpg",Body Parts,"Of and relating to the body, including bones, body parts, and facial features.",People,"People is a plurality of persons considered as a whole, as in an ethnic group or nation."
Socks,"Socks are made from soft materials, such as cotton, and worn on the feet. Socks help to absorb sweat and draw it to areas where it can be exposed to air and evaporate. Socks are also used as a means to keep the feet warm.","https://res.cloudinary.com/dhmaaz5iu/image/upload/v1578644074/51_188_k4wk6p.jpg",Feet,"Clothing that is worn on the foot, or feet (plural) such as socks and shoes.",Clothing,"Articles of clothing that can be worn on various parts of the body, such as the head or feet."
Fist Bump,"A fist bump is the bumping of fists between two individuals. A fist bump, also known as FTB, fist pound, or knuckle bump, is similar in meaning to a high five. It's usually a gesture of celebration or respect.","https://res.cloudinary.com/dhmaaz5iu/image/upload/v1578644115/47_349_pjcb6j.jpg",General Actions,All actions that do not fall into one of our specific categories. This is the catch all that contains most action related activities.,Activities,Activites involve anything that keep one active or in the state of being active. Activities usually involve some sort of action.
Plum,"A Plum is a sweet to tart tasting fruit that comes in a variety of colors. For example, Damson plums are often purple to black in color while Victoria plums are characterized by a yellow flesh.","https://res.cloudinary.com/dhmaaz5iu/image/upload/v1578644158/18_2523_iu8nqs.jpg",Fruit,Anything that falls into the fruit category.,Foods,"Delicious foods, including deserts and snacks."
Water Fountain,"A water fountain, also known as drinking fountain, is a structure that is designed to provide water through a continuous flow from a running tap. Water fountains are typically found outdoors in park or near playgrounds, or indoors near public gyms.","https://res.cloudinary.com/dhmaaz5iu/image/upload/v1578644197/57_316_q9fd0n.jpg",Outdoors,"Areas and places that can be found outdoors, such as park or playgrounds.",Places,"The places category contains PECS cards that are specific to what you may find in and around specific locations, such as a Doctor's Office or a School."
Play Drum,"The act of playing a drum typically involves the use of a specially designed mallet to strike the drum head. When hit, the drum produces a low frequency vibration.","https://res.cloudinary.com/dhmaaz5iu/image/upload/v1578644238/72_427_vtsg0k.jpg",Music,"Music is a form of art where sound is the common medium. Music consists of tempo, pitch, and rhythm. Music plays an important part of many cultures and can combine both song and instrumentals.",Activities,Activites involve anything that keep one active or in the state of being active. Activities usually involve some sort of action.
Owie,Owie is a word commonly used by small children or infants to describe a wound or pain.,"https://res.cloudinary.com/dhmaaz5iu/image/upload/v1578644281/32_91_s50gc9.jpg",Pain,"Pain is an unpleasant sensation often caused by intense or damaging stimuli such as stubbing a toe, burning a finger, putting alcohol on a cut, and bumping the ""funny bone.""",Communicating,"Communication is the activity of conveying information. Communication has been derived from the Latin word ""communis"", meaning to share. Communication requires a sender, a message, and an intended recipient, although the receiver need not be present or aware of the sender's intent to communicate at the time of communication; thus communication can occur across vast distances in time and space. Communication requires that the communicating parties share an area of communicative commonality."
Hammer,"A hammer is a hand-held tool that is used to deliver a forceful impact to an object, typically a nail. A standard hammer has an elongated handle with a heavy head at the end. The use of hammers dates back to about 2,400,000 BCE and is the oldest known human tool.","https://res.cloudinary.com/dhmaaz5iu/image/upload/v1578644328/9_196_ga9wpi.jpg",Hand Tools,Tools powered only by your hands.,Tools,"Various tools, including hand and power tools."
Underwear,Underwear are garments worn under pants or a dress and are designed to keep the wearer's private parts comfortable and concealed.,"https://res.cloudinary.com/dhmaaz5iu/image/upload/v1578644375/53_190_cbdzur.jpg",Lower Body,"Clothing worn on the lower part of the body, such as underwear or pants.",Clothing,"Articles of clothing that can be worn on various parts of the body, such as the head or feet."
No Pulling Hair,Pulling hair is the act of physically tugging on another being's hair with intent to cause injury.,"https://res.cloudinary.com/dhmaaz5iu/image/upload/v1578644418/40_326_kfrwzv.jpg",Behaviours,"Behaviours are a manner of behaving or conducting oneself in conjunction with one's environment as a response to stimuli, be it internal or external.",Communicating,"Communication is the activity of conveying information. Communication has been derived from the Latin word ""communis"", meaning to share. Communication requires a sender, a message, and an intended recipient, although the receiver need not be present or aware of the sender's intent to communicate at the time of communication; thus communication can occur across vast distances in time and space. Communication requires that the communicating parties share an area of communicative commonality."
Pointing,Pointing is a gesture used to often place emphasis on a thing or person. Pointing is often seen as a rude or hostile gesture when pointing at another person.,"https://res.cloudinary.com/dhmaaz5iu/image/upload/v1578644477/40_328_xtzytv.jpg",Behaviours,"Behaviours are a manner of behaving or conducting oneself in conjunction with one's environment as a response to stimuli, be it internal or external.",Communicating,"Communication is the activity of conveying information. Communication has been derived from the Latin word ""communis"", meaning to share. Communication requires a sender, a message, and an intended recipient, although the receiver need not be present or aware of the sender's intent to communicate at the time of communication; thus communication can occur across vast distances in time and space. Communication requires that the communicating parties share an area of communicative commonality."
Paper,"Paper is a material typically made by from pressing wood pulp and used for writing, printing or drawing.","https://res.cloudinary.com/dhmaaz5iu/image/upload/v1578644524/60_369_zsthuu.jpg",School,"Things of and related to school, which is an institution designated for teach students in various subjects, such as math, science, and literature.",Places,"The places category contains PECS cards that are specific to what you may find in and around specific locations, such as a Doctor's Office or a School."
