card-title,card-desc,card-img-url,card-category,card-category-desc,parent-category,parent-category-desc
Beef Stick,"A Beef Stick is a type of dried jerky that is often eaten as a snack. One of the most popular brands of beef sticks are Slim Jims, which are produced in excess of 500 million units annually.","https://res.cloudinary.com/dhmaaz5iu/image/upload/v1578990365/42_2525_b6xhag.jpg",Snacks and More,"Food that can be classified in numerous categories, with a main focus on snack foods.",Foods,"Delicious foods, including deserts and snacks."
Crying,"Crying (also called sobbing, weeping, bawling, and blubbering) is shedding tears as a response to an emotional state in humans. The act of crying has been defined as ""a complex secretomotor phenomenon characterized by the shedding of tears from the lacrimal apparatus, without any irritation of the ocular structures"".","https://res.cloudinary.com/dhmaaz5iu/image/upload/v1578990384/31_54_o9iyce.jpg",Emotions,"Emotion is a complex psychophysiological experience of an individual's state of mind as interacting with biochemical (internal) and environmental (external) influences. In humans, emotion fundamentally involves ""physiological arousal, expressive behaviors, and conscious experience.""",Communicating,"Communication is the activity of conveying information. Communication has been derived from the Latin word ""communis"", meaning to share. Communication requires a sender, a message, and an intended recipient, although the receiver need not be present or aware of the sender's intent to communicate at the time of communication; thus communication can occur across vast distances in time and space. Communication requires that the communicating parties share an area of communicative commonality."
Swim in Ocean,"A child swimming outside or in an ocean. Swimming is the act of self-propulsion though a body of water, sometime for fun or for sport, as well as therapy.","https://res.cloudinary.com/dhmaaz5iu/image/upload/v1578990405/49_2538_y4ngoh.jpg",Entertainment,"Entertainment refers to actions, activities, or events that are designed with the purpose of entertaining. This category includes everything from video games to watching movies.",Activities,Activites involve anything that keep one active or in the state of being active. Activities usually involve some sort of action.
June,June is the sixth month of the year and has a total of 30 days. June is characterized as being the beginning of summer in the Northern Hemisphere as well as having the longest daylight hours of the year.,"https://res.cloudinary.com/dhmaaz5iu/image/upload/v1578990429/73_487_plkrxx.jpg",Months,A month is a unit of time that relates to the revolution of the moon. Lunar calendars contain 12 months with an average of 30.5 days per month.,Basics,"Basics include topics such as shapes, time, currency, counting, and other cards that can be applied to every day life."
Listening,"Listening is how the brain processes what it hears through the central auditory system. Hearing is not necessarily the same as listening. To listen is to give your full attention to, understand, judge, and discuss what has been heard.","https://res.cloudinary.com/dhmaaz5iu/image/upload/v1578990448/70_361_ffvomv.jpg",Senses,"Senses are the physiological capacities of providing perceptual data to organisms. As humans, we have several traditional senses that include hearing, sight, smell, touch, and taste.",Communicating,"Communication is the activity of conveying information. Communication has been derived from the Latin word ""communis"", meaning to share. Communication requires a sender, a message, and an intended recipient, although the receiver need not be present or aware of the sender's intent to communicate at the time of communication; thus communication can occur across vast distances in time and space. Communication requires that the communicating parties share an area of communicative commonality."
m,M is the thirteenth letter in the alphabet and also represents the value one thousand in Roman numerals.,"https://res.cloudinary.com/dhmaaz5iu/image/upload/v1578990469/68_288_p7dg4z.jpg",Alphabet,The alphabet is a set of letters that are used to write and form words in one or more languages on the principle that the letters represent basic sounds.,Basics,"Basics include topics such as shapes, time, currency, counting, and other cards that can be applied to every day life."
Scratching,"Scratching is the act of causing physical abrasion of the skin, most commonly with the fingernails. Although scratching is often a reaction to an itch, some individuals scratch out of a compulsion.","https://res.cloudinary.com/dhmaaz5iu/image/upload/v1578990490/40_249_xdnac3.jpg",Behaviours,"Behaviours are a manner of behaving or conducting oneself in conjunction with one's environment as a response to stimuli, be it internal or external.",Communicating,"Communication is the activity of conveying information. Communication has been derived from the Latin word ""communis"", meaning to share. Communication requires a sender, a message, and an intended recipient, although the receiver need not be present or aware of the sender's intent to communicate at the time of communication; thus communication can occur across vast distances in time and space. Communication requires that the communicating parties share an area of communicative commonality."
Teddy Bear,"A teddy bear is a stuffed animal that resembles that of a bear. Teddy bears are popular gifts for children whom often grow an attachment to their stuffed pals. Modern outlets allow children (and adults) to purchase a bear of their choice to stuff, dress, and add fun accessories to. Some of the more popular bears in modern times include Gund bears and Boyds bears.","https://res.cloudinary.com/dhmaaz5iu/image/upload/v1578990512/61_239_djjzuz.jpg",Toy Store,"Things found in and around a toy store, which is a retail shop that specializes in the selling of games and toys.",Places,"The places category contains PECS cards that are specific to what you may find in and around specific locations, such as a Doctor's Office or a School."
No Climbing,"Climbing is the activity of using the limbs to ascend a steep object . Climbing can also be an activity that is done professionally or solely for entertainment, such as mountain climbing.","https://res.cloudinary.com/dhmaaz5iu/image/upload/v1578990535/40_179_j8wayu.jpg",Behaviours,"Behaviours are a manner of behaving or conducting oneself in conjunction with one's environment as a response to stimuli, be it internal or external.",Communicating,"Communication is the activity of conveying information. Communication has been derived from the Latin word ""communis"", meaning to share. Communication requires a sender, a message, and an intended recipient, although the receiver need not be present or aware of the sender's intent to communicate at the time of communication; thus communication can occur across vast distances in time and space. Communication requires that the communicating parties share an area of communicative commonality."
April,April is the fourth month of the year and has 30 days. April marks the beginning of spring in the Northern Hemisphere. Easter is celebrated in April on the first Sunday after the first full moon.,"https://res.cloudinary.com/dhmaaz5iu/image/upload/v1578990561/73_485_lcnktl.jpg",Months,A month is a unit of time that relates to the revolution of the moon. Lunar calendars contain 12 months with an average of 30.5 days per month.,Basics,"Basics include topics such as shapes, time, currency, counting, and other cards that can be applied to every day life."
Belt,"A belt, typically made from leather,  is a band that is worn around the waist to support trousers or other articles of clothing.","https://res.cloudinary.com/dhmaaz5iu/image/upload/v1578990586/53_192_xjcreu.jpg",Lower Body,"Clothing worn on the lower part of the body, such as underwear or pants.",Clothing,"Articles of clothing that can be worn on various parts of the body, such as the head or feet."
Cucumber,"The cucumber is a widely cultivated plant in the gourd family Cucurbitaceae, which includes squash, and in the same genus as the muskmelon. The plant is a creeping vine which bears cylindrical edible fruit when ripe. There are three main varieties of cucumber: ""slicing"", ""pickling"", and ""burpless"".","https://res.cloudinary.com/dhmaaz5iu/image/upload/v1578990613/19_5_jkppsn.jpg",Vegetables,Vegetables are parts of plants that are consumed by humans or other animals as food.,Foods,"Delicious foods, including deserts and snacks."
Halloween,"Halloween, which is short for All Hallows Evening, is a yearly tradition that falls on October 31st. Halloween is most commonly associated with costume parties, jack-o-lanterns, pumpkins, haunted houses, and the giving of candy.","https://res.cloudinary.com/dhmaaz5iu/image/upload/v1578990640/59_228_dwyfjz.jpg",Holidays,"A holiday is a designated day of special significance that celebrates religion, individuals, military, or government.  Some holidays, such as Christmas, are considered non-working holidays for the general population.",Basics,"Basics include topics such as shapes, time, currency, counting, and other cards that can be applied to every day life."
Stomachache,"Abdominal pain (or stomach ache) can be one of the symptoms associated with transient disorders or serious disease. Making a definitive diagnosis of the cause of abdominal pain can be difficult, because many diseases can result in this symptom. Abdominal pain is a common problem. Most frequently the cause is benign and/or self-limited, but more serious causes will and may require urgent intervention.","https://res.cloudinary.com/dhmaaz5iu/image/upload/v1578990670/32_64_lmg7qd.jpg",Pain,"Pain is an unpleasant sensation often caused by intense or damaging stimuli such as stubbing a toe, burning a finger, putting alcohol on a cut, and bumping the ""funny bone.""",Communicating,"Communication is the activity of conveying information. Communication has been derived from the Latin word ""communis"", meaning to share. Communication requires a sender, a message, and an intended recipient, although the receiver need not be present or aware of the sender's intent to communicate at the time of communication; thus communication can occur across vast distances in time and space. Communication requires that the communicating parties share an area of communicative commonality."
Angry,Anger is an automatic response to ill treatment. It is the way a person indicates he or she will not tolerate certain types of behaviour. It is a feedback mechanism in which an unpleasant stimulus is met with an unpleasant response.,"https://res.cloudinary.com/dhmaaz5iu/image/upload/v1578990700/31_53_x5ujs8.jpg",Emotions,"Emotion is a complex psychophysiological experience of an individual's state of mind as interacting with biochemical (internal) and environmental (external) influences. In humans, emotion fundamentally involves ""physiological arousal, expressive behaviors, and conscious experience.""",Communicating,"Communication is the activity of conveying information. Communication has been derived from the Latin word ""communis"", meaning to share. Communication requires a sender, a message, and an intended recipient, although the receiver need not be present or aware of the sender's intent to communicate at the time of communication; thus communication can occur across vast distances in time and space. Communication requires that the communicating parties share an area of communicative commonality."
Bounce Basketball,Bouncing a Basketball is the act of bouncing a ball against a hard surface with the palm of the hand. Successive bouncing with movement is referred to as dribbling and is a key component of the game of basketball.,"https://res.cloudinary.com/dhmaaz5iu/image/upload/v1578990740/75_2565_d6zaay.jpg",Sports,Sports refer to the collective forms of competitive activities through causal or organized participation.,Activities,Activites involve anything that keep one active or in the state of being active. Activities usually involve some sort of action.
Giraffe,"Giraffes are African, even-toed mammals that are the tallest terrestrial animal in the world. Giraffes have camel-like faces and spots that bare a resemblance to those of a leopard and can stand anywhere from 16 to 20 feet.","https://res.cloudinary.com/dhmaaz5iu/image/upload/v1578990760/14_94_sc3ib4.jpg",Mammals,"Mammals are members of class Mammalia, air-breathing vertebrate animals.",Animals,"Animals of all types, including pets and zoon animals."
Stairs,"Stairs, also known as a staircase, stairwell, or stairway (amongst other things) is made up of a series of steps. Each step is placed in succession and used to bridge a vertical distance between two points.","https://res.cloudinary.com/dhmaaz5iu/image/upload/v1578990775/67_2542_ofnyql.jpg",Misc Household,Things found in and around the household that may not belong to a specific category already defined.,Household,Objects and artefacts that can be found inside the home.
Hot Stove,A stove is a heating appliance that is used for the purpose of cooking. Stoves typically consist of two or more burners that work on the application of direct heat. Stoves may or may not include an oven.,"https://res.cloudinary.com/dhmaaz5iu/image/upload/v1578990790/45_437_mfx6yg.jpg",Kitchen,Items and activities that take place or are found in and around the kitchen.,Household,Objects and artefacts that can be found inside the home.
Scissors,"Scissors are sharp hand-operated cutting tool that consist of two metal blades joined together on a pivot so that the sharp edges slide against one another when the handle is closed. Scissors have a number of purposes, such as cutting hair, paper, and even meats.","https://res.cloudinary.com/dhmaaz5iu/image/upload/v1578990811/43_155_leqiv8.jpg",Bathroom,Items and activities that you would take place or be found in and around the bathroom.,Household,Objects and artefacts that can be found inside the home.
Grapes,"Grapes are non-climacteric fruit (they ripen without ethylene and respiration bursts) and are a type of berry that come from deciduous woody vines. They can be eaten raw and are often used in making juice, jelly, jam, and wine.","https://res.cloudinary.com/dhmaaz5iu/image/upload/v1578990828/18_87_fzqgt7.jpg",Fruit,Anything that falls into the fruit category.,Foods,"Delicious foods, including deserts and snacks."
e,"E is the fifth letter of the alphabet, as well as a vowel. E also has the distinction of being the most commonly used letter in the alphabet.","https://res.cloudinary.com/dhmaaz5iu/image/upload/v1578990852/68_272_u2epsn.jpg",Alphabet,The alphabet is a set of letters that are used to write and form words in one or more languages on the principle that the letters represent basic sounds.,Basics,"Basics include topics such as shapes, time, currency, counting, and other cards that can be applied to every day life."
Cold,"Cold, or feeling cold, is the perception of having a low temperature. The feeling of being cold is subjective based on metabolism, environmental surroundings, health, and personal preference.","https://res.cloudinary.com/dhmaaz5iu/image/upload/v1578990872/39_401_yy5cuw.jpg",General Communication,"Conveying information through various acts. This category groups many sub-categories together, such as greetings, indicators, and complex feedback.",Communicating,"Communication is the activity of conveying information. Communication has been derived from the Latin word ""communis"", meaning to share. Communication requires a sender, a message, and an intended recipient, although the receiver need not be present or aware of the sender's intent to communicate at the time of communication; thus communication can occur across vast distances in time and space. Communication requires that the communicating parties share an area of communicative commonality."
Calm Down,"To calm down is the act of relaxing oneself in the face of anxiety, stress, or anger in order to cope with the situation. Methods of calming down involve proper breathing techniques (breathe in through the nose, out through the mouth), tension release, and redirecting oneself to a safe environment.","https://res.cloudinary.com/dhmaaz5iu/image/upload/v1578990894/39_358_uiptjb.jpg",General Communication,"Conveying information through various acts. This category groups many sub-categories together, such as greetings, indicators, and complex feedback.",Communicating,"Communication is the activity of conveying information. Communication has been derived from the Latin word ""communis"", meaning to share. Communication requires a sender, a message, and an intended recipient, although the receiver need not be present or aware of the sender's intent to communicate at the time of communication; thus communication can occur across vast distances in time and space. Communication requires that the communicating parties share an area of communicative commonality."
Eye,"Eyes are the complex organs that detect light to allow us to see. The eyes consist of the lens, cornea, iris, retina, vitreous humor, optic nerve, and the aqueous humor.","https://res.cloudinary.com/dhmaaz5iu/image/upload/v1578990919/66_376_qh5g4z.jpg",Body Parts,"Of and relating to the body, including bones, body parts, and facial features.",People,"People is a plurality of persons considered as a whole, as in an ethnic group or nation."
Recorder,"A recorder is a woodwind instrument that is played by blowing into an end with the mouth while holding the recorder outward. Recorders can be made of a variety of materials, including wood, ivory, or plastic.","https://res.cloudinary.com/dhmaaz5iu/image/upload/v1578991055/72_432_qquldz.jpg",Music,"Music is a form of art where sound is the common medium. Music consists of tempo, pitch, and rhythm. Music plays an important part of many cultures and can combine both song and instrumentals.",Activities,Activites involve anything that keep one active or in the state of being active. Activities usually involve some sort of action.
No Stick Out Tongue,"To stick out ones tongue, which is the primary organ of taste, can often be considered a rude or unwelcome gesture by recipients of such an act.","https://res.cloudinary.com/dhmaaz5iu/image/upload/v1578991070/40_1528_hhe7nt.jpg",Behaviours,"Behaviours are a manner of behaving or conducting oneself in conjunction with one's environment as a response to stimuli, be it internal or external.",Communicating,"Communication is the activity of conveying information. Communication has been derived from the Latin word ""communis"", meaning to share. Communication requires a sender, a message, and an intended recipient, although the receiver need not be present or aware of the sender's intent to communicate at the time of communication; thus communication can occur across vast distances in time and space. Communication requires that the communicating parties share an area of communicative commonality."
No Scratching,"Scratching is the act of causing physical abrasion of the skin, most commonly with the fingernails. Although scratching is often a reaction to an itch, some individuals scratch out of a compulsion.","https://res.cloudinary.com/dhmaaz5iu/image/upload/v1578991087/40_327_zecyag.jpg",Behaviours,"Behaviours are a manner of behaving or conducting oneself in conjunction with one's environment as a response to stimuli, be it internal or external.",Communicating,"Communication is the activity of conveying information. Communication has been derived from the Latin word ""communis"", meaning to share. Communication requires a sender, a message, and an intended recipient, although the receiver need not be present or aware of the sender's intent to communicate at the time of communication; thus communication can occur across vast distances in time and space. Communication requires that the communicating parties share an area of communicative commonality."
Dog,"Dogs are domesticated animals that have a long standing relationship with humans. They are widely believed to have been the first domesticated animals used for working, hunting, and companionship.","https://res.cloudinary.com/dhmaaz5iu/image/upload/v1578991106/14_93_t5loub.jpg",Mammals,"Mammals are members of class Mammalia, air-breathing vertebrate animals.",Animals,"Animals of all types, including pets and zoon animals."
Muffin,"A muffin is  type of bakery item that is usually consumed as a breakfast treat. They are a type of quick bread that are baked in small portions and are often filled with a sweet filling, such as blueberries, chocolate chips, or cheese.","https://res.cloudinary.com/dhmaaz5iu/image/upload/v1578991124/41_408_iqh0lo.jpg",Breakfast,"Breakfast is typically the first meal eaten during the day, most often before startiing the daily routine or work.",Foods,"Delicious foods, including deserts and snacks."
No Sleeping,Card depicting a child sleeping in bed with a strike-out symbol to indicate that now is not the desired (or appropriate) time for sleep. Sleep is a natural recurring state that usually occurs in the horizontal position and is characterized by a reduction in consciousness and suspended sensory activity.,"https://res.cloudinary.com/dhmaaz5iu/image/upload/v1578991143/40_2536_ceu3pl.jpg",Behaviours,"Behaviours are a manner of behaving or conducting oneself in conjunction with one's environment as a response to stimuli, be it internal or external.",Communicating,"Communication is the activity of conveying information. Communication has been derived from the Latin word ""communis"", meaning to share. Communication requires a sender, a message, and an intended recipient, although the receiver need not be present or aware of the sender's intent to communicate at the time of communication; thus communication can occur across vast distances in time and space. Communication requires that the communicating parties share an area of communicative commonality."
Pigeon,"Part of the Columbidae species, Pigeons are stout-bodied birds that feed on plants, fruits and seeds. Pigeons closely resemble doves, and the names are often used interchangeably. Pigeons and doves have a vast distribution across the globe, found almost everywhere except the driest parts of the Sahara and in Antarctica.","https://res.cloudinary.com/dhmaaz5iu/image/upload/v1578991171/13_2544_dekmwi.jpg",Birds,Animals that belong to the bird kingdom.,Animals,"Animals of all types, including pets and zoon animals."
January,January is the first month of the year and is one of seven months in the year that has 31 days. On average January is the coldest month of the year in the Northern Hemisphere.,"https://res.cloudinary.com/dhmaaz5iu/image/upload/v1578991194/73_482_le6twf.jpg",Months,A month is a unit of time that relates to the revolution of the moon. Lunar calendars contain 12 months with an average of 30.5 days per month.,Basics,"Basics include topics such as shapes, time, currency, counting, and other cards that can be applied to every day life."
Acoustic Guitar,An acoustic guitar is a musical string instrument with a hollow body that is played by plucking or picking its strings. Acoustic guitars utilize an acoustic sound board to transmit the energy  from the vibration into sound.,"https://res.cloudinary.com/dhmaaz5iu/image/upload/v1578991217/72_420_ubdkia.jpg",Music,"Music is a form of art where sound is the common medium. Music consists of tempo, pitch, and rhythm. Music plays an important part of many cultures and can combine both song and instrumentals.",Activities,Activites involve anything that keep one active or in the state of being active. Activities usually involve some sort of action.
Put backpack on,"The act of putting on a backpack, which typically is worn over the shoulders.","https://res.cloudinary.com/dhmaaz5iu/image/upload/v1578991246/60_235_jfz9p7.jpg",School,"Things of and related to school, which is an institution designated for teach students in various subjects, such as math, science, and literature.",Places,"The places category contains PECS cards that are specific to what you may find in and around specific locations, such as a Doctor's Office or a School."
Yikes,"An exclamation of alarm, fright, or genuine surprise from a given situation or in reaction to the environment.","https://res.cloudinary.com/dhmaaz5iu/image/upload/v1578991287/39_123_ehjyih.jpg",General Communication,"Conveying information through various acts. This category groups many sub-categories together, such as greetings, indicators, and complex feedback.",Communicating,"Communication is the activity of conveying information. Communication has been derived from the Latin word ""communis"", meaning to share. Communication requires a sender, a message, and an intended recipient, although the receiver need not be present or aware of the sender's intent to communicate at the time of communication; thus communication can occur across vast distances in time and space. Communication requires that the communicating parties share an area of communicative commonality."
Put on Helmet,"The act of placing a protection device on one’s head.  Helmets are designed for safety and are worn in most major sports, including baseball, football, and hockey. Helmets should always be worn when riding a bike, skateboard, scooter or other mobile device.","https://res.cloudinary.com/dhmaaz5iu/image/upload/v1578991304/63_2567_wbh2kd.jpg",General Help,"Help is a form of assistance, both self-help and the helping of others. This category includes any action or process which can fall into the category of help.",Self-help,"Self-help, or self-improvement, is a self-guided improvement—economically, intellectually, or emotionally—often with a substantial psychological basis."
